{
  "schema_version": "artifact-diagram-taxonomy.v1",
  "generated_at": "2026-08-02",
  "products": [
    "blueprint",
    "acp",
    "shared"
  ],
  "access_levels": [
    "sample",
    "view_only",
    "downloadable",
    "premium",
    "restricted"
  ],
  "artifact_categories": [
    "functional",
    "technical",
    "commercial",
    "diagram",
    "prompt",
    "tool",
    "memory",
    "contract",
    "estimation",
    "package",
    "lineage"
  ],
  "diagram_categories": [
    "architecture",
    "orchestration",
    "tools",
    "memory",
    "flow",
    "knowledge",
    "data",
    "security",
    "deployment",
    "decisions",
    "integrations",
    "evaluation",
    "lineage"
  ],
  "artifact_entries": [
    {
      "artifact_key": "discovery.analysis",
      "title": "Analisis de descubrimiento",
      "description": "Contexto de negocio, problema, objetivos, restricciones y oportunidades capturadas desde Descubrir.",
      "category": "functional",
      "product_owner": "blueprint",
      "stage_owner": "discover",
      "access_level": "view_only",
      "formats": [
        "json",
        "markdown"
      ],
      "source_kind": "approved_journey_artifact",
      "portable_scope": "agent_specification",
      "blueprint_download": true,
      "acp_download": true,
      "internal_lean_refs_allowed": false,
      "canonical_paths": [
        "Blueprint/discovery/analysis.md",
        "ACP/business/discovery-analysis.yaml"
      ]
    },
    {
      "artifact_key": "definition.requirements",
      "title": "Requerimientos definidos",
      "description": "Requerimientos funcionales, no funcionales, alcance, fuera de alcance y reglas de negocio consolidadas.",
      "category": "functional",
      "product_owner": "blueprint",
      "stage_owner": "define",
      "access_level": "view_only",
      "formats": [
        "json",
        "markdown",
        "yaml"
      ],
      "source_kind": "approved_journey_artifact",
      "portable_scope": "agent_specification",
      "blueprint_download": true,
      "acp_download": true,
      "internal_lean_refs_allowed": false,
      "canonical_paths": [
        "Blueprint/requirements/requirements.md",
        "ACP/business/requirements.yaml"
      ]
    },
    {
      "artifact_key": "blueprint.architecture_spec",
      "title": "Especificacion de Arquitectura y Patrones",
      "description": "Arquitectura propuesta, topologia agentica, limites, responsabilidades, decisiones de diseno y patrones cognitivos de razonamiento y coordinacion.",
      "category": "technical",
      "product_owner": "blueprint",
      "stage_owner": "design",
      "access_level": "premium",
      "formats": [
        "json",
        "markdown",
        "yaml"
      ],
      "source_kind": "approved_journey_artifact",
      "portable_scope": "agent_specification",
      "blueprint_download": true,
      "acp_download": true,
      "internal_lean_refs_allowed": false,
      "canonical_paths": [
        "Blueprint/architecture/architecture.md",
        "ACP/architecture/topology.yaml"
      ]
    },
    {
      "artifact_key": "blueprint.patterns",
      "title": "Patrones agenticos seleccionados",
      "description": "Patrones de razonamiento, coordinacion, handoff, criticidad y colaboracion entre agentes.",
      "category": "technical",
      "product_owner": "blueprint",
      "stage_owner": "design",
      "access_level": "view_only",
      "formats": [
        "json",
        "markdown",
        "yaml"
      ],
      "source_kind": "approved_journey_artifact",
      "portable_scope": "agent_specification",
      "blueprint_download": true,
      "acp_download": true,
      "internal_lean_refs_allowed": false,
      "canonical_paths": [
        "Blueprint/architecture/patterns.md",
        "ACP/cognition/reasoning.yaml"
      ]
    },
    {
      "artifact_key": "tools.minimum_set",
      "title": "Herramientas minimas recomendadas",
      "description": "Conjunto minimo de herramientas obligatorias, opcionales e innecesarias con justificacion y riesgos.",
      "category": "tool",
      "product_owner": "blueprint",
      "stage_owner": "tools",
      "access_level": "premium",
      "formats": [
        "json",
        "markdown",
        "yaml"
      ],
      "source_kind": "approved_journey_artifact",
      "portable_scope": "agent_specification",
      "blueprint_download": true,
      "acp_download": true,
      "internal_lean_refs_allowed": false,
      "canonical_paths": [
        "Blueprint/tools/minimum-tools.md",
        "ACP/tools/tool-inventory.yaml"
      ]
    },
    {
      "artifact_key": "tools.contracts",
      "title": "Contratos de herramientas",
      "description": "Contratos de entrada, salida, permisos, aprobaciones, side effects, retries y compensaciones.",
      "category": "contract",
      "product_owner": "shared",
      "stage_owner": "tools",
      "access_level": "premium",
      "formats": [
        "json",
        "yaml"
      ],
      "source_kind": "generated_acp_file",
      "portable_scope": "construction_package",
      "blueprint_download": true,
      "acp_download": true,
      "internal_lean_refs_allowed": false,
      "canonical_paths": [
        "Blueprint/tools/contracts.md",
        "ACP/tools/contracts/"
      ]
    },
    {
      "artifact_key": "memory.strategy",
      "title": "Estrategia de memoria",
      "description": "Memoria corta, memoria larga, RAG, recuperacion, compactacion, budgets de contexto y trazabilidad.",
      "category": "memory",
      "product_owner": "blueprint",
      "stage_owner": "memory",
      "access_level": "premium",
      "formats": [
        "json",
        "markdown",
        "yaml"
      ],
      "source_kind": "approved_journey_artifact",
      "portable_scope": "agent_specification",
      "blueprint_download": true,
      "acp_download": true,
      "internal_lean_refs_allowed": false,
      "canonical_paths": [
        "Blueprint/memory/strategy.md",
        "ACP/memory/strategy.yaml"
      ]
    },
    {
      "artifact_key": "knowledge.contract",
      "title": "Contrato de conocimiento",
      "description": "Fuentes, ownership, sensibilidad, linaje, permisos y reglas de recuperacion para conocimiento del agente.",
      "category": "contract",
      "product_owner": "shared",
      "stage_owner": "memory",
      "access_level": "premium",
      "formats": [
        "json",
        "yaml"
      ],
      "source_kind": "generated_acp_file",
      "portable_scope": "construction_package",
      "blueprint_download": true,
      "acp_download": true,
      "internal_lean_refs_allowed": false,
      "canonical_paths": [
        "Blueprint/knowledge/knowledge-contract.md",
        "ACP/knowledge/knowledge-contract.yaml"
      ]
    },
    {
      "artifact_key": "blueprint.professional_document",
      "title": "Blueprint Profesional",
      "description": "Documento funcional, tecnico y comercial del sistema agentico para decision y compra.",
      "category": "commercial",
      "product_owner": "blueprint",
      "stage_owner": "estimate",
      "access_level": "downloadable",
      "formats": [
        "markdown",
        "pdf",
        "docx",
        "json"
      ],
      "source_kind": "generated_blueprint_export",
      "portable_scope": "commercial_value",
      "blueprint_download": true,
      "acp_download": false,
      "internal_lean_refs_allowed": false,
      "canonical_paths": [
        "Blueprint/blueprint-professional.md"
      ]
    },
    {
      "artifact_key": "estimate.comparison",
      "title": "Estimacion y ROI",
      "description": "Comparativa de esfuerzo, costo, tiempo, riesgo, intervencion humana y ROI entre escenarios.",
      "category": "estimation",
      "product_owner": "blueprint",
      "stage_owner": "estimate",
      "access_level": "premium",
      "formats": [
        "json",
        "markdown"
      ],
      "source_kind": "approved_journey_artifact",
      "portable_scope": "commercial_value",
      "blueprint_download": true,
      "acp_download": true,
      "internal_lean_refs_allowed": false,
      "canonical_paths": [
        "Blueprint/estimate/roi.md",
        "ACP/estimation/estimation-report.json"
      ]
    },
    {
      "artifact_key": "diagrams.blueprint_bundle",
      "title": "Bundle de diagramas Blueprint",
      "description": "Diagramas de arquitectura, orquestacion, herramientas, memoria, flujo, conocimiento, seguridad e integraciones.",
      "category": "diagram",
      "product_owner": "blueprint",
      "stage_owner": "estimate",
      "access_level": "downloadable",
      "formats": [
        "svg",
        "mermaid",
        "markdown"
      ],
      "source_kind": "generated_diagram",
      "portable_scope": "commercial_value",
      "blueprint_download": true,
      "acp_download": true,
      "internal_lean_refs_allowed": false,
      "canonical_paths": [
        "Blueprint/diagrams/"
      ]
    },
    {
      "artifact_key": "validation.simulation_spec",
      "title": "Especificacion de simulacion",
      "description": "Escenarios representativos, decisiones, herramientas, memoria y rutas esperadas para validar antes de construir.",
      "category": "technical",
      "product_owner": "acp",
      "stage_owner": "validate",
      "access_level": "premium",
      "formats": [
        "json",
        "yaml",
        "markdown"
      ],
      "source_kind": "approved_journey_artifact",
      "portable_scope": "construction_package",
      "blueprint_download": false,
      "acp_download": true,
      "internal_lean_refs_allowed": false,
      "canonical_paths": [
        "ACP/evaluation/simulation-spec.yaml"
      ]
    },
    {
      "artifact_key": "evaluation.test_suite",
      "title": "Test Suite de implementacion",
      "description": "Casos de prueba, criterios de aceptacion, datos esperados, quality gates y regresiones.",
      "category": "technical",
      "product_owner": "acp",